{
  "$schema": "/schema/1.0.0/license-profile.json",
  "keyword": "Apache-2.0",
  "licenseName": "Apache 2.0",
  "intro": "This Acumos software file is distributed by Nordix Foundation under the Apache License, Version 2.0 (the \"License\"); you may not use this file except in compliance with the License. You may obtain a copy of the License at",
  "copyright": {
    "year": 2019,
    "company": "Company A",
    "suffix": "A Intellectual Property. All rights reserved."
  },
  "softwareType": "Acumos Ai/ML Model",
  "companyName": "Acumos",
  "contact": {
    "name": "Acumos HelpDesk",
    "URL": "https://marketplace.acumos.org",
    "email": "contact@.acumos.org"
  },
  "additionalInfo": "This Acumos software file is distributed by Nordix Foundation under the Apache License, Version 2.0 (the \"License\"); you may not use this file except in compliance with the License. You may obtain a copy of the License at"
}