{
  "keyword": "Apache-2.0",
  "licenseName": "Apache License 2.0",
  "copyright": {
    "year": 2019,
    "company": "Company A",
    "suffix": "All Rights Reserved"
  },
  "softwareType": "Machine Learning Model",
  "companyName": "Company A",
  "contact": {
    "name": "Company A  Team Member",
    "URL": "http://companya.com",
    "email": "support@companya.com"
  }
}